[
  { "id": "knowledge-200", "title": "冰滴壶的滴滤装置", "category": "器具", "plain_explanation": "冰滴壶是一套竖直的滴滤装置：顶端水箱由水管控制水滴流量，水一滴一滴落在咖啡粉上，穿过滤纸和陶瓷滤器，再由蛇形管汇进底部的咖啡壶。", "source_book": "咖啡全书", "source_chapter": "调配·浸泡法", "source_quote": "冷水涓涓滴在咖啡渣上面， 在穿过咖啡粉滴入咖 啡壶时， 释放出香气， 呈现质感和色泽。……其顶端带有一个水箱， 由一条水管控制开关， 控制水 滴的流量； 在下方有咖啡粉存放槽， 上面放着一张滤纸， 确保水均匀 流到咖啡粉的整个表面。在咖啡渣下面有一个陶瓷滤器， 防止残渣进 入咖啡液， 连接着一条外形美观小巧的蛇形管， 最底部是一个漂亮的 咖啡壶， 用于接纳滴下来的咖啡液。", "confidence": "medium", "related_stages": [], "inference_note": "原书此段只称「冷泡法」，未出现「冰滴」字样；新线杯名「冰滴」指的就是这套竖直滴滤装置，故卡面按游戏术语写作冰滴壶，摘录保留原文。", "source_locator": "b2 block.14" },
  { "id": "knowledge-201", "title": "冷萃的粉水比与时长", "category": "冲煮", "plain_explanation": "冷萃选细幼粉，粉水比是160克粉对1升水；冷泡时的滴速约每分钟30滴，浸泡12、24或36小时，泡得太浓可以加少许清水稀释。", "source_book": "咖啡全书", "source_chapter": "调配·浸泡法", "source_quote": "选用浓缩咖啡之类的细幼咖啡粉和一个大咖啡杯，并以160克 咖啡粉对应1升水的比例称取粉量。……在上方壶内注入水 ，调整滴漏速度（尝试12、24、36小时浸 泡） 。每分钟30滴为基本速度。", "confidence": "medium", "related_stages": [], "inference_note": "原书只称「冷泡法」，未出现「冷萃」字样；新线杯名「冷萃」与之对应，故卡面按游戏术语命名，参数照原文数字摘录；滴速出自书里的冷泡流程，不另作「冰滴专用」归属。", "source_locator": "b2 block.14" }
]
